concept,platform,status,main_risk,decision_owner,launch_window
Cinder Orange Cold Brew,Cold coffee,Decision package,Citrus confusion,Maya Chen,Summer 2026
Tropical Green Tea Sparkler,Tea and Refreshers,Flavor testing,Less coffee relevance,Anika Rao,Summer 2026
Lavender Cream Cold Foam,Cold foam,Creative testing,Floral fatigue,Marcus Lee,Spring 2026
Protein Vanilla Cold Brew,Cold coffee,Nutrition review,Claims and texture,Nina Patel,Fall 2026
Horchata Oat Espresso,Espresso,Supply review,Ingredient complexity,Eli Morgan,Fall 2026

